me advertiram sobre isso,medo
ate que enfim nao aguentava mais te esperar,raiva
eu quero meu dinheiro de volta agora!,raiva
eu odeio a escola!,raiva
vou fazer picadinho de voce,raiva
detesto trabalhar no ver�o,raiva
quero minha comida e quero agora!,raiva
melhor voce recolher minhas compras agora!,raiva
quero descer agora sua maluca,raiva
vou reclamar com o gerente!,raiva
vai engolir o que disse!,raiva
ele me ridiculariza diante de todos,raiva
nao quero mais saber de voce,raiva
vejo voce na cadeia safado!,raiva
agora vou ter que pagar mais isso ainda!,raiva
saia logo do banheiro!,raiva
suba ja para o seu quarto!,raiva
eu falei para calar a boca seu idiota!,raiva
eu disse para voce cair fora!,raiva
nao aguento mais que fiquem me culpando sem motivo!,raiva
nao suporto olhar na sua cara!,raiva
eu nao sou um elefante,raiva
juro que se olhar pra mim eu o mato!,raiva
chega nao quero saber mais deste assunto,raiva
como pode ser taoburro?,raiva
nao me aborreca seu moleque,raiva
nao quero me aborrecer com estas bobagens,raiva
ele me agrediu!,raiva
eu amaldicao voce e a sua familia,raiva
nao me amole,raiva
nao venha me amolar,raiva
isso tudo e uma tormenta,raiva
eu vou matar voce,raiva
para que simplificar se voce pode sempre complicar,raiva
isso esta me enlouquecendo,raiva
estou furiosa com voce,raiva
isso mesmo fique furioso,raiva
esses livros sao magnificos,surpresa
esse vinho e magnifico,surpresa
seria magnifico ver o esperaculo,surpresa
o casamento foi estupendo,surpresa
e um jogador barbaro estupendo,surpresa
esse dia esta excelente,surpresa
o cantor estava excelente,surpresa
o universo e assombroso,surpresa
o amor e sublime,surpresa
sua sublime atuacao,surpresa
e formidavel meu caro walter,surpresa
como e formidavel a presensa de todos,surpresa
e formidavel ter a quem dizer adeus,surpresa
e um conselheiro formidavel o seu,surpresa
o artigo foi formidavel,surpresa
pica pau e um destaque no imaginario brasileiro,surpresa
ah! o absoluto do imaginario,surpresa
isso foi surreal,surpresa
uma historia completamente surreal,surpresa
essas pinturas beiram o surreal,surpresa
voce nem acreditam de taosurreal,surpresa
incrivel!,surpresa
fiquei pasma com tudo isso,surpresa
voce me deixa pasmo,surpresa
estou admirado com a sua astucia,surpresa
que bela surpresa voce me fez,surpresa
nao acredito que fez isso!,surpresa
isso foi apavorante,surpresa
isso taode repente,surpresa
estou chocada com isso,surpresa
estou surpresa e desconsertada,surpresa
esta realmente deslumbrante querida,surpresa
fiquei completamente sem plavras,surpresa
e espantoso o modo como ele nos olha,surpresa
incrivel voce estar aqui,surpresa
que fantastica festa minha querida,surpresa
isso tudo e um erro,tristeza
eu sou errada eu sou errante,tristeza
tenho muito da do cachorro,tristeza
e dolorida a perda de um filho,tristeza
essa tragedia vai nos abalar para sempre,tristeza
perdi meus filhos,tristeza
perdi meu curso,tristeza
sou so uma chorona,tristeza
voce e um chorao,tristeza
se arrependimento matasse,tristeza
me sinto deslocado em sala de aula,tristeza
foi uma passagem triste,tristeza
nossa condolencias e tristeza a sua perda,tristeza
desanimo raiva solidao ou vazies depressao,tristeza
vivo te desanimando,tristeza
estou desanimado,tristeza
imperador sanguinario depravado e temeroso,tristeza
meu ser esta em agonia,tristeza
este atrito entre nos tem que acabar,tristeza
a escuridao desola meu ser,tristeza
sua falsa preocupacao,tristeza
sua falsidade me entristece,tristeza
quem esta descontente com os outros esta descontente consigo proprio,tristeza
a torcida esta descontente com a demissao do tecnico,tristeza
estou bastante aborrecido com o jornal,tristeza
me sinto solitario e entediado,tristeza
a vida e solitaria para aqueles que nao sao falsos,tristeza
como com compulsao depois da depressao,tristeza
estou me desencorajando a viver,tristeza
ele desencoraja minhas vontades,tristeza
isso vai deprimindo por dentro,tristeza
acho que isso e defeituoso,tristeza
os remedios me derrubam na cama,tristeza
a depressao vai me derrubar,tristeza
suas desculpas sao falsas,tristeza
nao magoe as pessoas,tristeza
